cutlass_gemm_mainloop/results.csv
M,N,K,TILE_M,TILE_N,TILE_K,STAGES,dtype,time_ms,TFLOPS
64,16,131072,64,16,16,0,BF16,0.764357,0.351191
64,16,131072,64,16,16,2,BF16,1.51016,0.177754
64,16,131072,64,16,16,3,BF16,1.02456,0.261999
64,16,131072,64,16,16,4,BF16,0.801915,0.334743
64,16,131072,64,16,16,5,BF16,0.767373,0.349811
64,16,131072,64,16,16,6,BF16,0.774398,0.346637
64,16,131072,64,16,16,7,BF16,0.784072,0.342361
64,16,131072,64,16,16,8,BF16,0.76813,0.349466
64,16,131072,64,16,32,0,BF16,0.391358,0.685907
64,16,131072,64,16,32,2,BF16,0.809662,0.33154
64,16,131072,64,16,32,3,BF16,0.554579,0.484034
64,16,131072,64,16,32,4,BF16,0.409893,0.654892
64,16,131072,64,16,32,5,BF16,0.39013,0.688067
64,16,131072,64,16,32,6,BF16,0.401621,0.66838
64,16,131072,64,16,32,7,BF16,0.412123,0.651348
64,16,131072,64,16,32,8,BF16,0.39571,0.678363
64,16,131072,64,16,64,0,BF16,0.199378,1.34637
64,16,131072,64,16,64,2,BF16,0.436059,0.615594
64,16,131072,64,16,64,3,BF16,0.292941,0.916347
64,16,131072,64,16,64,4,BF16,0.225976,1.18789
64,16,131072,64,16,64,5,BF16,0.209974,1.27842
64,16,131072,64,16,64,6,BF16,0.21864,1.22775
64,16,131072,64,16,64,7,BF16,0.22703,1.18238
64,16,131072,64,16,64,8,BF16,0.199747,1.34388
64,16,131072,64,16,128,0,BF16,0.170038,1.57868
64,16,131072,64,16,128,2,BF16,0.296264,0.906068
64,16,131072,64,16,128,3,BF16,0.194448,1.3805
64,16,131072,64,16,128,4,BF16,0.164307,1.63374
64,16,131072,64,16,128,5,BF16,0.171168,1.56826
64,16,131072,64,16,128,6,BF16,0.176552,1.52043
64,16,131072,64,16,128,7,BF16,0.182606,1.47002
64,16,131072,64,16,128,8,BF16,0.164234,1.63447
64,16,131072,64,16,256,0,BF16,0.168282,1.59516
64,16,131072,64,16,256,2,BF16,0.229885,1.1677
64,16,131072,64,16,256,3,BF16,0.162235,1.65461
64,16,131072,64,16,256,4,BF16,0.168366,1.59435
64,16,131072,64,16,256,5,BF16,0.174899,1.5348
# BUILD_FAILED: 64,16,256,6,0
# BUILD_FAILED: 64,16,256,7,0
# BUILD_FAILED: 64,16,256,8,0
64,32,131072,64,32,16,0,BF16,0.83393,0.643784
64,32,131072,64,32,16,2,BF16,1.58168,0.339432
64,32,131072,64,32,16,3,BF16,1.05089,0.510872
64,32,131072,64,32,16,4,BF16,0.791674,0.678147
64,32,131072,64,32,16,5,BF16,0.772318,0.695142
64,32,131072,64,32,16,6,BF16,0.766245,0.700652
64,32,131072,64,32,16,7,BF16,0.773779,0.69383
64,32,131072,64,32,16,8,BF16,0.760666,0.705791
64,32,131072,64,32,32,0,BF16,0.392662,1.36726
64,32,131072,64,32,32,2,BF16,0.839096,0.639821
64,32,131072,64,32,32,3,BF16,0.559552,0.959466
64,32,131072,64,32,32,4,BF16,0.427102,1.25701
64,32,131072,64,32,32,5,BF16,0.389723,1.37757
64,32,131072,64,32,32,6,BF16,0.401608,1.3368
64,32,131072,64,32,32,7,BF16,0.396581,1.35375
64,32,131072,64,32,32,8,BF16,0.390504,1.37482
64,32,131072,64,32,64,0,BF16,0.19891,2.69906
64,32,131072,64,32,64,2,BF16,0.465659,1.15293
64,32,131072,64,32,64,3,BF16,0.319373,1.68102
64,32,131072,64,32,64,4,BF16,0.231854,2.31555
64,32,131072,64,32,64,5,BF16,0.201083,2.66989
64,32,131072,64,32,64,6,BF16,0.199458,2.69165
64,32,131072,64,32,64,7,BF16,0.20961,2.56129
64,32,131072,64,32,64,8,BF16,0.214211,2.50627
64,32,131072,64,32,128,0,BF16,0.168421,3.18768
64,32,131072,64,32,128,2,BF16,0.31348,1.71262
64,32,131072,64,32,128,3,BF16,0.205144,2.61704
64,32,131072,64,32,128,4,BF16,0.174408,3.07825
64,32,131072,64,32,128,5,BF16,0.179664,2.98819
64,32,131072,64,32,128,6,BF16,0.169454,3.16823
64,32,131072,64,32,128,7,BF16,0.174406,3.07828
64,32,131072,64,32,128,8,BF16,0.168237,3.19116
64,32,131072,64,32,256,0,BF16,0.167934,3.19691
64,32,131072,64,32,256,2,BF16,0.241899,2.2194
64,32,131072,64,32,256,3,BF16,0.167115,3.21258
64,32,131072,64,32,256,4,BF16,0.168123,3.19332
# BUILD_FAILED: 64,32,256,5,0
# BUILD_FAILED: 64,32,256,6,0
# BUILD_FAILED: 64,32,256,7,0
# BUILD_FAILED: 64,32,256,8,0
64,64,131072,64,64,16,0,BF16,0.803067,1.33705
64,64,131072,64,64,16,2,BF16,2.59899,0.413139
64,64,131072,64,64,16,3,BF16,1.74991,0.613598
64,64,131072,64,64,16,4,BF16,1.29893,0.826636
64,64,131072,64,64,16,5,BF16,1.0892,0.985811
64,64,131072,64,64,16,6,BF16,0.973558,1.1029
64,64,131072,64,64,16,7,BF16,0.88561,1.21243
64,64,131072,64,64,16,8,BF16,0.840986,1.27677
64,64,131072,64,64,32,0,BF16,0.391581,2.74207
64,64,131072,64,64,32,2,BF16,1.36995,0.783784
64,64,131072,64,64,32,3,BF16,0.936082,1.14706
64,64,131072,64,64,32,4,BF16,0.739979,1.45104
64,64,131072,64,64,32,5,BF16,0.597606,1.79674
64,64,131072,64,64,32,6,BF16,0.521304,2.05972
64,64,131072,64,64,32,7,BF16,0.456402,2.35263
64,64,131072,64,64,32,8,BF16,0.438534,2.44848
64,64,131072,64,64,64,0,BF16,0.214898,4.99653
64,64,131072,64,64,64,2,BF16,0.781947,1.37316
64,64,131072,64,64,64,3,BF16,0.512005,2.09713
64,64,131072,64,64,64,4,BF16,0.38507,2.78843
64,64,131072,64,64,64,5,BF16,0.305912,3.50997
64,64,131072,64,64,64,6,BF16,0.284474,3.77449
64,64,131072,64,64,64,7,BF16,0.255622,4.2005
64,64,131072,64,64,64,8,BF16,0.220875,4.86131
64,64,131072,64,64,128,0,BF16,0.19841,5.41174
64,64,131072,64,64,128,2,BF16,0.494019,2.17348
64,64,131072,64,64,128,3,BF16,0.324381,3.31013
64,64,131072,64,64,128,4,BF16,0.262402,4.09198
64,64,131072,64,64,128,5,BF16,0.231344,4.64132
64,64,131072,64,64,128,6,BF16,0.232821,4.61188
64,64,131072,64,64,128,7,BF16,0.24052,4.46425
# BUILD_FAILED: 64,64,128,8,0
64,64,131072,64,64,256,0,BF16,0.285898,3.75569
64,64,131072,64,64,256,2,BF16,0.340992,3.14888
64,64,131072,64,64,256,3,BF16,0.230624,4.65581
# BUILD_FAILED: 64,64,256,4,0
# BUILD_FAILED: 64,64,256,5,0
# BUILD_FAILED: 64,64,256,6,0
# BUILD_FAILED: 64,64,256,7,0
# BUILD_FAILED: 64,64,256,8,0
64,128,131072,64,128,16,0,BF16,1.02285,2.09951
64,128,131072,64,128,16,2,BF16,3.82241,0.561814
64,128,131072,64,128,16,3,BF16,2.45711,0.873988
64,128,131072,64,128,16,4,BF16,1.94817,1.10231
64,128,131072,64,128,16,5,BF16,1.62218,1.32382
64,128,131072,64,128,16,6,BF16,1.31811,1.62922
64,128,131072,64,128,16,7,BF16,1.13623,1.89
64,128,131072,64,128,16,8,BF16,1.03783,2.0692
64,128,131072,64,128,32,0,BF16,0.515352,4.16702
64,128,131072,64,128,32,2,BF16,1.98431,1.08223
64,128,131072,64,128,32,3,BF16,1.30803,1.64176
64,128,131072,64,128,32,4,BF16,0.988962,2.17145
64,128,131072,64,128,32,5,BF16,0.804829,2.66825
64,128,131072,64,128,32,6,BF16,0.681013,3.15337
64,128,131072,64,128,32,7,BF16,0.627928,3.41995
64,128,131072,64,128,32,8,BF16,0.533958,4.02182
64,128,131072,64,128,64,0,BF16,0.363469,5.9083
64,128,131072,64,128,64,2,BF16,1.05723,2.03124
64,128,131072,64,128,64,3,BF16,0.719082,2.98643
64,128,131072,64,128,64,4,BF16,0.610608,3.51696
64,128,131072,64,128,64,5,BF16,0.442179,4.85659
64,128,131072,64,128,64,6,BF16,0.389522,5.51313
64,128,131072,64,128,64,7,BF16,0.462917,4.63903
64,128,131072,64,128,64,8,BF16,0.384738,5.58168
64,128,131072,64,128,128,0,BF16,0.466549,4.60291
64,128,131072,64,128,128,2,BF16,0.912722,2.35284
64,128,131072,64,128,128,3,BF16,0.492784,4.35786
64,128,131072,64,128,128,4,BF16,0.455386,4.71575
# BUILD_FAILED: 64,128,128,5,0
# BUILD_FAILED: 64,128,128,6,0
# BUILD_FAILED: 64,128,128,7,0
# BUILD_FAILED: 64,128,128,8,0
64,128,131072,64,128,256,0,BF16,0.614555,3.49437
64,128,131072,64,128,256,2,BF16,0.548134,3.9178
# BUILD_FAILED: 64,128,256,3,0
# BUILD_FAILED: 64,128,256,4,0
# BUILD_FAILED: 64,128,256,5,0
# BUILD_FAILED: 64,128,256,6,0
# BUILD_FAILED: 64,128,256,7,0
# BUILD_FAILED: 64,128,256,8,0
64,192,131072,64,192,16,0,BF16,1.39624,2.30707
64,192,131072,64,192,16,2,BF16,4.01197,0.802903
64,192,131072,64,192,16,3,BF16,2.98572,1.07888
64,192,131072,64,192,16,4,BF16,2.23178,1.44334
64,192,131072,64,192,16,5,BF16,2.20115,1.46343
64,192,131072,64,192,16,6,BF16,1.56232,2.06183
64,192,131072,64,192,16,7,BF16,1.46266,2.2023
64,192,131072,64,192,16,8,BF16,1.52622,2.11059
64,192,131072,64,192,32,0,BF16,0.70725,4.55458
64,192,131072,64,192,32,2,BF16,2.41968,1.33126
64,192,131072,64,192,32,3,BF16,1.65611,1.94505
64,192,131072,64,192,32,4,BF16,1.56945,2.05246
64,192,131072,64,192,32,5,BF16,1.16713,2.75996
64,192,131072,64,192,32,6,BF16,1.05269,3.05998
64,192,131072,64,192,32,7,BF16,1.06948,3.01196
64,192,131072,64,192,32,8,BF16,0.74239,4.33899
64,192,131072,64,192,64,0,BF16,0.52485,6.13743
64,192,131072,64,192,64,2,BF16,1.27778,2.52095
64,192,131072,64,192,64,3,BF16,0.853754,3.77302
64,192,131072,64,192,64,4,BF16,0.642582,5.01294
64,192,131072,64,192,64,5,BF16,0.549888,5.85797
64,192,131072,64,192,64,6,BF16,0.550101,5.8557
64,192,131072,64,192,64,7,BF16,0.522754,6.16203
# BUILD_FAILED: 64,192,64,8,0
64,192,131072,64,192,128,0,BF16,0.588642,5.4723
64,192,131072,64,192,128,2,BF16,0.870938,3.69857
64,192,131072,64,192,128,3,BF16,0.583302,5.52239
# BUILD_FAILED: 64,192,128,4,0
# BUILD_FAILED: 64,192,128,5,0
# BUILD_FAILED: 64,192,128,6,0
# BUILD_FAILED: 64,192,128,7,0
# BUILD_FAILED: 64,192,128,8,0
# BUILD_FAILED: 64,192,256,0,0
# BUILD_FAILED: 64,192,256,2,0
# BUILD_FAILED: 64,192,256,3,0
# BUILD_FAILED: 64,192,256,4,0
# BUILD_FAILED: 64,192,256,5,0
# BUILD_FAILED: 64,192,256,6,0
# BUILD_FAILED: 64,192,256,7,0
# BUILD_FAILED: 64,192,256,8,0
64,256,131072,64,256,16,0,BF16,1.69436,2.53487
64,256,131072,64,256,16,2,BF16,4.40494,0.975035
64,256,131072,64,256,16,3,BF16,2.92198,1.46988
64,256,131072,64,256,16,4,BF16,2.45944,1.74632
64,256,131072,64,256,16,5,BF16,1.96785,2.18256
64,256,131072,64,256,16,6,BF16,1.81694,2.36384
64,256,131072,64,256,16,7,BF16,1.81298,2.36901
64,256,131072,64,256,16,8,BF16,1.81248,2.36966
64,256,131072,64,256,32,0,BF16,0.908059,4.72983
64,256,131072,64,256,32,2,BF16,2.40872,1.78309
64,256,131072,64,256,32,3,BF16,1.51092,2.84262
64,256,131072,64,256,32,4,BF16,1.24172,3.45888
64,256,131072,64,256,32,5,BF16,1.01349,4.23778
64,256,131072,64,256,32,6,BF16,0.931768,4.60948
64,256,131072,64,256,32,7,BF16,0.915837,4.68966
64,256,131072,64,256,32,8,BF16,0.916714,4.68518
64,256,131072,64,256,64,0,BF16,0.684739,6.27241
64,256,131072,64,256,64,2,BF16,1.3566,3.16599
64,256,131072,64,256,64,3,BF16,0.957562,4.48532
64,256,131072,64,256,64,4,BF16,0.703107,6.10855
64,256,131072,64,256,64,5,BF16,0.681411,6.30305
# BUILD_FAILED: 64,256,64,6,0
# BUILD_FAILED: 64,256,64,7,0
# BUILD_FAILED: 64,256,64,8,0
64,256,131072,64,256,128,0,BF16,0.993677,4.3223
64,256,131072,64,256,128,2,BF16,0.97877,4.38813
# BUILD_FAILED: 64,256,128,3,0
# BUILD_FAILED: 64,256,128,4,0
# BUILD_FAILED: 64,256,128,5,0
# BUILD_FAILED: 64,256,128,6,0
# BUILD_FAILED: 64,256,128,7,0
# BUILD_FAILED: 64,256,128,8,0
# BUILD_FAILED: 64,256,256,0,0
# BUILD_FAILED: 64,256,256,2,0
# BUILD_FAILED: 64,256,256,3,0
# BUILD_FAILED: 64,256,256,4,0
# BUILD_FAILED: 64,256,256,5,0
# BUILD_FAILED: 64,256,256,6,0
# BUILD_FAILED: 64,256,256,7,0
# BUILD_FAILED: 64,256,256,8,0
128,16,131072,128,16,16,0,BF16,0.772253,0.695201
128,16,131072,128,16,16,2,BF16,3.39038,0.158351
128,16,131072,128,16,16,3,BF16,2.29819,0.233606
128,16,131072,128,16,16,4,BF16,1.71623,0.31282
128,16,131072,128,16,16,5,BF16,1.46416,0.366675
128,16,131072,128,16,16,6,BF16,1.16877,0.459346
128,16,131072,128,16,16,7,BF16,1.04516,0.513671
128,16,131072,128,16,16,8,BF16,1.06654,0.503376
128,16,131072,128,16,32,0,BF16,0.399298,1.34454
128,16,131072,128,16,32,2,BF16,1.96559,0.273135
128,16,131072,128,16,32,3,BF16,1.21829,0.440674
128,16,131072,128,16,32,4,BF16,0.902536,0.594847
128,16,131072,128,16,32,5,BF16,0.876874,0.612256
128,16,131072,128,16,32,6,BF16,0.78016,0.688155
128,16,131072,128,16,32,7,BF16,0.741963,0.723582
128,16,131072,128,16,32,8,BF16,0.794006,0.676154
128,16,131072,128,16,64,0,BF16,0.300243,1.78812
128,16,131072,128,16,64,2,BF16,1.14659,0.468232
128,16,131072,128,16,64,3,BF16,0.805003,0.666918
128,16,131072,128,16,64,4,BF16,0.665658,0.806527
128,16,131072,128,16,64,5,BF16,0.592037,0.90682
128,16,131072,128,16,64,6,BF16,0.418546,1.28271
128,16,131072,128,16,64,7,BF16,0.409334,1.31157
128,16,131072,128,16,64,8,BF16,0.450061,1.19289
128,16,131072,128,16,128,0,BF16,0.345686,1.55306
128,16,131072,128,16,128,2,BF16,0.758314,0.70798
128,16,131072,128,16,128,3,BF16,0.50271,1.06795
128,16,131072,128,16,128,4,BF16,0.492888,1.08924
128,16,131072,128,16,128,5,BF16,0.385166,1.39387
128,16,131072,128,16,128,6,BF16,0.269963,1.98868
# BUILD_FAILED: 128,16,128,7,0
# BUILD_FAILED: 128,16,128,8,0
128,16,131072,128,16,256,0,BF16,0.368702,1.45611
128,16,131072,128,16,256,2,BF16,0.523576,1.02539
128,16,131072,128,16,256,3,BF16,0.324042,1.6568
# BUILD_FAILED: 128,16,256,4,0
# BUILD_FAILED: 128,16,256,5,0
# BUILD_FAILED: 128,16,256,6,0
# BUILD_FAILED: 128,16,256,7,0
# BUILD_FAILED: 128,16,256,8,0
128,32,131072,128,32,16,0,BF16,0.860973,1.24713
128,32,131072,128,32,16,2,BF16,4.3332,0.247794
128,32,131072,128,32,16,3,BF16,2.73359,0.392795
128,32,131072,128,32,16,4,BF16,2.3407,0.458727
128,32,131072,128,32,16,5,BF16,1.85306,0.579444
128,32,131072,128,32,16,6,BF16,1.70718,0.628956
128,32,131072,128,32,16,7,BF16,1.56393,0.686568
128,32,131072,128,32,16,8,BF16,1.39849,0.767787
128,32,131072,128,32,32,0,BF16,0.42768,2.51062
128,32,131072,128,32,32,2,BF16,2.2519,0.476817
128,32,131072,128,32,32,3,BF16,1.54182,0.696412
128,32,131072,128,32,32,4,BF16,1.18272,0.907857
128,32,131072,128,32,32,5,BF16,0.973578,1.10288
128,32,131072,128,32,32,6,BF16,0.875187,1.22687
128,32,131072,128,32,32,7,BF16,0.702323,1.52884
128,32,131072,128,32,32,8,BF16,0.691595,1.55256
128,32,131072,128,32,64,0,BF16,0.317854,3.37809
128,32,131072,128,32,64,2,BF16,1.17375,0.914794
128,32,131072,128,32,64,3,BF16,0.827032,1.29831
128,32,131072,128,32,64,4,BF16,0.63901,1.68032
128,32,131072,128,32,64,5,BF16,0.691699,1.55232
128,32,131072,128,32,64,6,BF16,0.492363,2.18079
128,32,131072,128,32,64,7,BF16,0.426373,2.51832
128,32,131072,128,32,64,8,BF16,0.379323,2.83068
128,32,131072,128,32,128,0,BF16,0.374896,2.86411
128,32,131072,128,32,128,2,BF16,0.776373,1.38302
128,32,131072,128,32,128,3,BF16,0.558949,1.921
128,32,131072,128,32,128,4,BF16,0.387378,2.77182
128,32,131072,128,32,128,5,BF16,0.338085,3.17595
# BUILD_FAILED: 128,32,128,6,0
# BUILD_FAILED: 128,32,128,7,0
# BUILD_FAILED: 128,32,128,8,0
128,32,131072,128,32,256,0,BF16,0.503197,2.13384
128,32,131072,128,32,256,2,BF16,0.520114,2.06444
# BUILD_FAILED: 128,32,256,3,0
# BUILD_FAILED: 128,32,256,4,0
# BUILD_FAILED: 128,32,256,5,0
# BUILD_FAILED: 128,32,256,6,0
# BUILD_FAILED: 128,32,256,7,0
# BUILD_FAILED: 128,32,256,8,0
128,64,131072,128,64,16,0,BF16,1.02549,2.0941
128,64,131072,128,64,16,2,BF16,4.40311,0.48772
128,64,131072,128,64,16,3,BF16,3.03124,0.70845
128,64,131072,128,64,16,4,BF16,2.36671,0.907369
128,64,131072,128,64,16,5,BF16,1.99884,1.07437
128,64,131072,128,64,16,6,BF16,1.73359,1.23875
128,64,131072,128,64,16,7,BF16,1.41555,1.51707
128,64,131072,128,64,16,8,BF16,1.35859,1.58068
128,64,131072,128,64,32,0,BF16,0.509918,4.21143
128,64,131072,128,64,32,2,BF16,2.28673,0.939107
128,64,131072,128,64,32,3,BF16,1.59351,1.34765
128,64,131072,128,64,32,4,BF16,1.30963,1.63977
128,64,131072,128,64,32,5,BF16,1.06445,2.01746
128,64,131072,128,64,32,6,BF16,0.983027,2.18456
128,64,131072,128,64,32,7,BF16,0.870643,2.46655
128,64,131072,128,64,32,8,BF16,0.765336,2.80594
128,64,131072,128,64,64,0,BF16,0.433547,4.95329
128,64,131072,128,64,64,2,BF16,1.31546,1.6325
128,64,131072,128,64,64,3,BF16,0.875731,2.45222
128,64,131072,128,64,64,4,BF16,0.673088,3.19049
128,64,131072,128,64,64,5,BF16,0.556792,3.85689
128,64,131072,128,64,64,6,BF16,0.52649,4.07887
128,64,131072,128,64,64,7,BF16,0.45567,4.7128
128,64,131072,128,64,64,8,BF16,0.410995,5.22508
128,64,131072,128,64,128,0,BF16,0.466626,4.60216
128,64,131072,128,64,128,2,BF16,0.975926,2.20046
128,64,131072,128,64,128,3,BF16,0.557931,3.84901
128,64,131072,128,64,128,4,BF16,0.527573,4.0705
# BUILD_FAILED: 128,64,128,5,0
# BUILD_FAILED: 128,64,128,6,0
# BUILD_FAILED: 128,64,128,7,0
# BUILD_FAILED: 128,64,128,8,0
128,64,131072,128,64,256,0,BF16,0.579683,3.70458
128,64,131072,128,64,256,2,BF16,0.614115,3.49687
# BUILD_FAILED: 128,64,256,3,0
# BUILD_FAILED: 128,64,256,4,0
# BUILD_FAILED: 128,64,256,5,0
# BUILD_FAILED: 128,64,256,6,0
# BUILD_FAILED: 128,64,256,7,0
# BUILD_FAILED: 128,64,256,8,0
128,128,131072,128,128,16,0,BF16,1.34781,3.18663
128,128,131072,128,128,16,2,BF16,4.92648,0.871812
128,128,131072,128,128,16,3,BF16,3.58447,1.19821
128,128,131072,128,128,16,4,BF16,2.80391,1.53178
128,128,131072,128,128,16,5,BF16,2.22062,1.93413
128,128,131072,128,128,16,6,BF16,2.03239,2.11326
128,128,131072,128,128,16,7,BF16,1.8546,2.31585
128,128,131072,128,128,16,8,BF16,1.66665,2.577
128,128,131072,128,128,32,0,BF16,0.687027,6.25152
128,128,131072,128,128,32,2,BF16,2.7869,1.54113
128,128,131072,128,128,32,3,BF16,1.92358,2.2328
128,128,131072,128,128,32,4,BF16,1.58021,2.71797
128,128,131072,128,128,32,5,BF16,1.32445,3.24282
128,128,131072,128,128,32,6,BF16,1.15128,3.73061
128,128,131072,128,128,32,7,BF16,1.10949,3.87112
128,128,131072,128,128,32,8,BF16,0.949227,4.5247
128,128,131072,128,128,64,0,BF16,0.568171,7.55928
128,128,131072,128,128,64,2,BF16,1.53409,2.79969
128,128,131072,128,128,64,3,BF16,1.04905,4.09413
128,128,131072,128,128,64,4,BF16,0.800853,5.36299
128,128,131072,128,128,64,5,BF16,0.674621,6.36649
128,128,131072,128,128,64,6,BF16,0.594184,7.22835
128,128,131072,128,128,64,7,BF16,0.508272,8.45014
# BUILD_FAILED: 128,128,64,8,0
128,128,131072,128,128,128,0,BF16,0.64484,6.66052
128,128,131072,128,128,128,2,BF16,0.911966,4.70957
128,128,131072,128,128,128,3,BF16,0.640691,6.70365
# BUILD_FAILED: 128,128,128,4,0
# BUILD_FAILED: 128,128,128,5,0
# BUILD_FAILED: 128,128,128,6,0
# BUILD_FAILED: 128,128,128,7,0
# BUILD_FAILED: 128,128,128,8,0
# BUILD_FAILED: 128,128,256,0,0
# BUILD_FAILED: 128,128,256,2,0
# BUILD_FAILED: 128,128,256,3,0
# BUILD_FAILED: 128,128,256,4,0
# BUILD_FAILED: 128,128,256,5,0
# BUILD_FAILED: 128,128,256,6,0
# BUILD_FAILED: 128,128,256,7,0
# BUILD_FAILED: 128,128,256,8,0
128,192,131072,128,192,16,0,BF16,1.7242,3.73649
128,192,131072,128,192,16,2,BF16,5.53819,1.16328
128,192,131072,128,192,16,3,BF16,3.91373,1.64611
128,192,131072,128,192,16,4,BF16,3.15509,2.04192
128,192,131072,128,192,16,5,BF16,2.59482,2.48281
128,192,131072,128,192,16,6,BF16,2.22985,2.88918
128,192,131072,128,192,16,7,BF16,2.11677,3.04352
128,192,131072,128,192,16,8,BF16,1.90396,3.38371
128,192,131072,128,192,32,0,BF16,0.877237,7.34403
128,192,131072,128,192,32,2,BF16,3.04402,2.11643
128,192,131072,128,192,32,3,BF16,2.07098,3.11083
128,192,131072,128,192,32,4,BF16,1.588,4.05695
128,192,131072,128,192,32,5,BF16,1.33678,4.81938
128,192,131072,128,192,32,6,BF16,1.18097,5.4552
128,192,131072,128,192,32,7,BF16,1.12021,5.75112
128,192,131072,128,192,32,8,BF16,1.00832,6.38929
128,192,131072,128,192,64,0,BF16,0.732446,8.7958
128,192,131072,128,192,64,2,BF16,1.59289,4.04451
128,192,131072,128,192,64,3,BF16,1.12093,5.74743
128,192,131072,128,192,64,4,BF16,0.865805,7.441
128,192,131072,128,192,64,5,BF16,0.740821,8.69637
# BUILD_FAILED: 128,192,64,6,0
# BUILD_FAILED: 128,192,64,7,0
# BUILD_FAILED: 128,192,64,8,0
128,192,131072,128,192,128,0,BF16,1.09595,5.87842
128,192,131072,128,192,128,2,BF16,1.10738,5.81773
# BUILD_FAILED: 128,192,128,3,0
# BUILD_FAILED: 128,192,128,4,0
# BUILD_FAILED: 128,192,128,5,0
# BUILD_FAILED: 128,192,128,6,0
# BUILD_FAILED: 128,192,128,7,0
# BUILD_FAILED: 128,192,128,8,0
# BUILD_FAILED: 128,192,256,0,0
# BUILD_FAILED: 128,192,256,2,0
# BUILD_FAILED: 128,192,256,3,0
# BUILD_FAILED: 128,192,256,4,0
# BUILD_FAILED: 128,192,256,5,0
# BUILD_FAILED: 128,192,256,6,0
# BUILD_FAILED: 128,192,256,7,0
# BUILD_FAILED: 128,192,256,8,0
128,256,131072,128,256,16,0,BF16,2.02412,4.24379
128,256,131072,128,256,16,2,BF16,6.25505,1.37328
128,256,131072,128,256,16,3,BF16,4.44812,1.93114
128,256,131072,128,256,16,4,BF16,3.49666,2.45661
128,256,131072,128,256,16,5,BF16,3.12169,2.75169
128,256,131072,128,256,16,6,BF16,2.56322,3.35123
128,256,131072,128,256,16,7,BF16,2.40855,3.56643
128,256,131072,128,256,16,8,BF16,2.33381,3.68065
128,256,131072,128,256,32,0,BF16,1.09568,7.83979
128,256,131072,128,256,32,2,BF16,3.04231,2.82349
128,256,131072,128,256,32,3,BF16,2.17261,3.95374
128,256,131072,128,256,32,4,BF16,1.76155,4.87636
128,256,131072,128,256,32,5,BF16,1.41116,6.08713
128,256,131072,128,256,32,6,BF16,1.27684,6.7275
128,256,131072,128,256,32,7,BF16,1.20032,7.15637
128,256,131072,128,256,32,8,BF16,1.12342,7.64625
128,256,131072,128,256,64,0,BF16,0.907718,9.46322
128,256,131072,128,256,64,2,BF16,1.74275,4.92896
128,256,131072,128,256,64,3,BF16,1.2123,7.08566
128,256,131072,128,256,64,4,BF16,0.914683,9.39116
# BUILD_FAILED: 128,256,64,5,0
# BUILD_FAILED: 128,256,64,6,0
# BUILD_FAILED: 128,256,64,7,0
# BUILD_FAILED: 128,256,64,8,0
128,256,131072,128,256,128,0,BF16,1.21019,7.09802
128,256,131072,128,256,128,2,BF16,1.27336,6.74586
# BUILD_FAILED: 128,256,128,3,0
# BUILD_FAILED: 128,256,128,4,0
# BUILD_FAILED: 128,256,128,5,0
# BUILD_FAILED: 128,256,128,6,0
# BUILD_FAILED: 128,256,128,7,0
# BUILD_FAILED: 128,256,128,8,0
# BUILD_FAILED: 128,256,256,0,0
# BUILD_FAILED: 128,256,256,2,0
# BUILD_FAILED: 128,256,256,3,0
# BUILD_FAILED: 128,256,256,4,0
# BUILD_FAILED: 128,256,256,5,0
# BUILD_FAILED: 128,256,256,6,0
# BUILD_FAILED: 128,256,256,7,0
# BUILD_FAILED: 128,256,256,8,0
64,16,131072,64,16,32,0,FP8_E4M3,0.389051,0.689975
64,16,131072,64,16,32,2,FP8_E4M3,0.772086,0.347675
64,16,131072,64,16,32,3,FP8_E4M3,0.530018,0.506465
64,16,131072,64,16,32,4,FP8_E4M3,0.425848,0.630355
64,16,131072,64,16,32,5,FP8_E4M3,0.439155,0.611254
64,16,131072,64,16,32,6,FP8_E4M3,0.390109,0.688104
64,16,131072,64,16,32,7,FP8_E4M3,0.388082,0.691698
64,16,131072,64,16,32,8,FP8_E4M3,0.394067,0.681192
64,16,131072,64,16,64,0,FP8_E4M3,0.207888,1.29125
64,16,131072,64,16,64,2,FP8_E4M3,0.423702,0.633547
64,16,131072,64,16,64,3,FP8_E4M3,0.275485,0.974411
64,16,131072,64,16,64,4,FP8_E4M3,0.20759,1.2931
64,16,131072,64,16,64,5,FP8_E4M3,0.200368,1.33971
64,16,131072,64,16,64,6,FP8_E4M3,0.207398,1.2943
64,16,131072,64,16,64,7,FP8_E4M3,0.20141,1.33278
64,16,131072,64,16,64,8,FP8_E4M3,0.207558,1.2933
64,16,131072,64,16,128,0,FP8_E4M3,0.110866,2.42127
64,16,131072,64,16,128,2,FP8_E4M3,0.242253,1.10808
64,16,131072,64,16,128,3,FP8_E4M3,0.170701,1.57255
64,16,131072,64,16,128,4,FP8_E4M3,0.132734,2.02235
64,16,131072,64,16,128,5,FP8_E4M3,0.10272,2.61327
64,16,131072,64,16,128,6,FP8_E4M3,0.106512,2.52024
64,16,131072,64,16,128,7,FP8_E4M3,0.109021,2.46224
64,16,131072,64,16,128,8,FP8_E4M3,0.11316,2.37218
64,16,131072,64,16,256,0,FP8_E4M3,0.0966976,2.77603
64,16,131072,64,16,256,2,FP8_E4M3,0.171389,1.56624
64,16,131072,64,16,256,3,FP8_E4M3,0.0993168,2.70282
64,16,131072,64,16,256,4,FP8_E4M3,0.0884224,3.03583
64,16,131072,64,16,256,5,FP8_E4M3,0.0904848,2.96664
64,16,131072,64,16,256,6,FP8_E4M3,0.0946208,2.83696
64,16,131072,64,16,256,7,FP8_E4M3,0.0966736,2.77672
64,16,131072,64,16,256,8,FP8_E4M3,0.100811,2.66275
64,16,131072,64,16,512,0,FP8_E4M3,0.104811,2.56113
64,16,131072,64,16,512,2,FP8_E4M3,0.141782,1.89329
64,16,131072,64,16,512,3,FP8_E4M3,0.0843024,3.1842
64,16,131072,64,16,512,4,FP8_E4M3,0.087616,3.06377
64,16,131072,64,16,512,5,FP8_E4M3,0.0899696,2.98362
# BUILD_FAILED: 64,16,512,6,1
# BUILD_FAILED: 64,16,512,7,1
# BUILD_FAILED: 64,16,512,8,1
64,32,131072,64,32,32,0,FP8_E4M3,0.441067,1.21721
64,32,131072,64,32,32,2,FP8_E4M3,0.823635,0.651831
64,32,131072,64,32,32,3,FP8_E4M3,0.543352,0.988072
64,32,131072,64,32,32,4,FP8_E4M3,0.41353,1.29826
64,32,131072,64,32,32,5,FP8_E4M3,0.396226,1.35496
64,32,131072,64,32,32,6,FP8_E4M3,0.391835,1.37014
64,32,131072,64,32,32,7,FP8_E4M3,0.408648,1.31377
64,32,131072,64,32,32,8,FP8_E4M3,0.419082,1.28107
64,32,131072,64,32,64,0,FP8_E4M3,0.203024,2.64437
64,32,131072,64,32,64,2,FP8_E4M3,0.436643,1.22954
64,32,131072,64,32,64,3,FP8_E4M3,0.287621,1.86659
64,32,131072,64,32,64,4,FP8_E4M3,0.222163,2.41656
64,32,131072,64,32,64,5,FP8_E4M3,0.201379,2.66597
64,32,131072,64,32,64,6,FP8_E4M3,0.201246,2.66773
64,32,131072,64,32,64,7,FP8_E4M3,0.209106,2.56746
64,32,131072,64,32,64,8,FP8_E4M3,0.199154,2.69576
64,32,131072,64,32,128,0,FP8_E4M3,0.10681,5.02643
64,32,131072,64,32,128,2,FP8_E4M3,0.244368,2.19698
64,32,131072,64,32,128,3,FP8_E4M3,0.157462,3.40952
64,32,131072,64,32,128,4,FP8_E4M3,0.119061,4.50922
64,32,131072,64,32,128,5,FP8_E4M3,0.107712,4.98432
64,32,131072,64,32,128,6,FP8_E4M3,0.110714,4.84919
64,32,131072,64,32,128,7,FP8_E4M3,0.113979,4.71025
64,32,131072,64,32,128,8,FP8_E4M3,0.11724,4.57925
64,32,131072,64,32,256,0,FP8_E4M3,0.102806,5.22215
64,32,131072,64,32,256,2,FP8_E4M3,0.18663,2.87665
64,32,131072,64,32,256,3,FP8_E4M3,0.131896,4.07041
64,32,131072,64,32,256,4,FP8_E4M3,0.11777,4.55865
64,32,131072,64,32,256,5,FP8_E4M3,0.123171,4.35874
64,32,131072,64,32,256,6,FP8_E4M3,0.127446,4.21252
64,32,131072,64,32,256,7,FP8_E4M3,0.133458,4.02278
64,32,131072,64,32,256,8,FP8_E4M3,0.139742,3.84186
64,32,131072,64,32,512,0,FP8_E4M3,0.145901,3.6797
64,32,131072,64,32,512,2,FP8_E4M3,0.207858,2.58288
64,32,131072,64,32,512,3,FP8_E4M3,0.164104,3.27153
64,32,131072,64,32,512,4,FP8_E4M3,0.176499,3.04178
# BUILD_FAILED: 64,32,512,5,1
# BUILD_FAILED: 64,32,512,6,1
# BUILD_FAILED: 64,32,512,7,1
# BUILD_FAILED: 64,32,512,8,1
64,64,131072,64,64,32,0,FP8_E4M3,0.696989,1.54054
64,64,131072,64,64,32,2,FP8_E4M3,0.858928,1.2501
64,64,131072,64,64,32,3,FP8_E4M3,0.573163,1.87336
64,64,131072,64,64,32,4,FP8_E4M3,0.433326,2.47791
64,64,131072,64,64,32,5,FP8_E4M3,0.394926,2.71884
64,64,131072,64,64,32,6,FP8_E4M3,0.408765,2.6268
64,64,131072,64,64,32,7,FP8_E4M3,0.393829,2.72642
64,64,131072,64,64,32,8,FP8_E4M3,0.39167,2.74144
64,64,131072,64,64,64,0,FP8_E4M3,0.205795,5.21753
64,64,131072,64,64,64,2,FP8_E4M3,0.490331,2.18983
64,64,131072,64,64,64,3,FP8_E4M3,0.338792,3.16932
64,64,131072,64,64,64,4,FP8_E4M3,0.238325,4.50537
64,64,131072,64,64,64,5,FP8_E4M3,0.202531,5.30161
64,64,131072,64,64,64,6,FP8_E4M3,0.200955,5.34319
64,64,131072,64,64,64,7,FP8_E4M3,0.207008,5.18696
64,64,131072,64,64,64,8,FP8_E4M3,0.213258,5.03495
64,64,131072,64,64,128,0,FP8_E4M3,0.114971,9.33922
64,64,131072,64,64,128,2,FP8_E4M3,0.289309,3.7114
64,64,131072,64,64,128,3,FP8_E4M3,0.202344,5.30652
64,64,131072,64,64,128,4,FP8_E4M3,0.132253,8.11886
64,64,131072,64,64,128,5,FP8_E4M3,0.11059,9.70918
64,64,131072,64,64,128,6,FP8_E4M3,0.110779,9.69263
64,64,131072,64,64,128,7,FP8_E4M3,0.11505,9.33286
64,64,131072,64,64,128,8,FP8_E4M3,0.119275,9.00222
64,64,131072,64,64,256,0,FP8_E4M3,0.119082,9.01686
64,64,131072,64,64,256,2,FP8_E4M3,0.216232,4.96569
64,64,131072,64,64,256,3,FP8_E4M3,0.153195,7.00898
64,64,131072,64,64,256,4,FP8_E4M3,0.100718,10.6608
64,64,131072,64,64,256,5,FP8_E4M3,0.102728,10.4523
64,64,131072,64,64,256,6,FP8_E4M3,0.106928,10.0417
64,64,131072,64,64,256,7,FP8_E4M3,0.11092,9.68033
# BUILD_FAILED: 64,64,256,8,1
64,64,131072,64,64,512,0,FP8_E4M3,0.119978,8.94952
64,64,131072,64,64,512,2,FP8_E4M3,0.168962,6.35495
64,64,131072,64,64,512,3,FP8_E4M3,0.129486,8.29231
# BUILD_FAILED: 64,64,512,4,1
# BUILD_FAILED: 64,64,512,5,1
# BUILD_FAILED: 64,64,512,6,1
# BUILD_FAILED: 64,64,512,7,1
# BUILD_FAILED: 64,64,512,8,1
64,128,131072,64,128,32,0,FP8_E4M3,0.673602,3.18806
64,128,131072,64,128,32,2,FP8_E4M3,0.984186,2.18199
64,128,131072,64,128,32,3,FP8_E4M3,0.665947,3.22471
64,128,131072,64,128,32,4,FP8_E4M3,0.527112,4.07406
64,128,131072,64,128,32,5,FP8_E4M3,0.50911,4.21811
64,128,131072,64,128,32,6,FP8_E4M3,0.520426,4.1264
64,128,131072,64,128,32,7,FP8_E4M3,0.523942,4.0987
64,128,131072,64,128,32,8,FP8_E4M3,0.517122,4.15276
64,128,131072,64,128,64,0,FP8_E4M3,0.260512,8.24332
64,128,131072,64,128,64,2,FP8_E4M3,0.559042,3.84137
64,128,131072,64,128,64,3,FP8_E4M3,0.386272,5.55951
64,128,131072,64,128,64,4,FP8_E4M3,0.297987,7.20663
64,128,131072,64,128,64,5,FP8_E4M3,0.281395,7.63156
64,128,131072,64,128,64,6,FP8_E4M3,0.264365,8.12318
64,128,131072,64,128,64,7,FP8_E4M3,0.263611,8.14641
64,128,131072,64,128,64,8,FP8_E4M3,0.263218,8.15859
64,128,131072,64,128,128,0,FP8_E4M3,0.182706,11.7538
64,128,131072,64,128,128,2,FP8_E4M3,0.341517,6.28808
64,128,131072,64,128,128,3,FP8_E4M3,0.238886,8.98956
64,128,131072,64,128,128,4,FP8_E4M3,0.178509,12.0301
64,128,131072,64,128,128,5,FP8_E4M3,0.178437,12.035
64,128,131072,64,128,128,6,FP8_E4M3,0.184674,11.6285
64,128,131072,64,128,128,7,FP8_E4M3,0.19045,11.2759
64,128,131072,64,128,128,8,FP8_E4M3,0.197064,10.8974
64,128,131072,64,128,256,0,FP8_E4M3,0.203499,10.5528
64,128,131072,64,128,256,2,FP8_E4M3,0.284912,7.53736
64,128,131072,64,128,256,3,FP8_E4M3,0.219885,9.7664
64,128,131072,64,128,256,4,FP8_E4M3,0.179936,11.9347
# BUILD_FAILED: 64,128,256,5,1
# BUILD_FAILED: 64,128,256,6,1
# BUILD_FAILED: 64,128,256,7,1
# BUILD_FAILED: 64,128,256,8,1
64,128,131072,64,128,512,0,FP8_E4M3,0.215669,9.95732
64,128,131072,64,128,512,2,FP8_E4M3,0.209336,10.2585
# BUILD_FAILED: 64,128,512,3,1
# BUILD_FAILED: 64,128,512,4,1
# BUILD_FAILED: 64,128,512,5,1
# BUILD_FAILED: 64,128,512,6,1
# BUILD_FAILED: 64,128,512,7,1
# BUILD_FAILED: 64,128,512,8,1
64,192,131072,64,192,32,0,FP8_E4M3,0.69484,4.63592
64,192,131072,64,192,32,2,FP8_E4M3,1.80348,1.78612
64,192,131072,64,192,32,3,FP8_E4M3,1.19657,2.69206
64,192,131072,64,192,32,4,FP8_E4M3,0.942104,3.41918
64,192,131072,64,192,32,5,FP8_E4M3,0.771762,4.17386
64,192,131072,64,192,32,6,FP8_E4M3,0.701245,4.59358
64,192,131072,64,192,32,7,FP8_E4M3,0.693891,4.64226
64,192,131072,64,192,32,8,FP8_E4M3,0.694824,4.63603
64,192,131072,64,192,64,0,FP8_E4M3,0.351758,9.15749
64,192,131072,64,192,64,2,FP8_E4M3,0.988106,3.26
64,192,131072,64,192,64,3,FP8_E4M3,0.652605,4.93595
64,192,131072,64,192,64,4,FP8_E4M3,0.500725,6.43313
64,192,131072,64,192,64,5,FP8_E4M3,0.398286,8.08771
64,192,131072,64,192,64,6,FP8_E4M3,0.360542,8.93439
64,192,131072,64,192,64,7,FP8_E4M3,0.354,9.09951
64,192,131072,64,192,64,8,FP8_E4M3,0.351163,9.17302
64,192,131072,64,192,128,0,FP8_E4M3,0.276787,11.6379
64,192,131072,64,192,128,2,FP8_E4M3,0.592301,5.4385
64,192,131072,64,192,128,3,FP8_E4M3,0.375629,8.57556
64,192,131072,64,192,128,4,FP8_E4M3,0.296558,10.862
64,192,131072,64,192,128,5,FP8_E4M3,0.28515,11.2966
64,192,131072,64,192,128,6,FP8_E4M3,0.29699,10.8462
64,192,131072,64,192,128,7,FP8_E4M3,0.269042,11.973
# BUILD_FAILED: 64,192,128,8,1
64,192,131072,64,192,256,0,FP8_E4M3,0.280214,11.4956
64,192,131072,64,192,256,2,FP8_E4M3,0.393067,8.1951
64,192,131072,64,192,256,3,FP8_E4M3,0.270805,11.895
# BUILD_FAILED: 64,192,256,4,1
# BUILD_FAILED: 64,192,256,5,1
# BUILD_FAILED: 64,192,256,6,1
# BUILD_FAILED: 64,192,256,7,1
# BUILD_FAILED: 64,192,256,8,1
# BUILD_FAILED: 64,192,512,0,1
# BUILD_FAILED: 64,192,512,2,1
# BUILD_FAILED: 64,192,512,3,1
# BUILD_FAILED: 64,192,512,4,1
# BUILD_FAILED: 64,192,512,5,1
# BUILD_FAILED: 64,192,512,6,1
# BUILD_FAILED: 64,192,512,7,1
# BUILD_FAILED: 64,192,512,8,1
64,256,131072,64,256,32,0,FP8_E4M3,0.887104,4.84156
64,256,131072,64,256,32,2,FP8_E4M3,2.75679,1.55796
64,256,131072,64,256,32,3,FP8_E4M3,1.81919,2.36093
64,256,131072,64,256,32,4,FP8_E4M3,1.45799,2.94581
64,256,131072,64,256,32,5,FP8_E4M3,1.23788,3.46961
64,256,131072,64,256,32,6,FP8_E4M3,1.09572,3.91976
64,256,131072,64,256,32,7,FP8_E4M3,0.95496,4.49754
64,256,131072,64,256,32,8,FP8_E4M3,0.886968,4.8423
64,256,131072,64,256,64,0,FP8_E4M3,0.447131,9.60561
64,256,131072,64,256,64,2,FP8_E4M3,1.4335,2.99614
64,256,131072,64,256,64,3,FP8_E4M3,0.99493,4.31686
64,256,131072,64,256,64,4,FP8_E4M3,0.814675,5.272
64,256,131072,64,256,64,5,FP8_E4M3,0.649766,6.61002
64,256,131072,64,256,64,6,FP8_E4M3,0.590117,7.27816
64,256,131072,64,256,64,7,FP8_E4M3,0.499165,8.60431
64,256,131072,64,256,64,8,FP8_E4M3,0.47708,9.00261
64,256,131072,64,256,128,0,FP8_E4M3,0.397026,10.8179
64,256,131072,64,256,128,2,FP8_E4M3,0.824059,5.21196
64,256,131072,64,256,128,3,FP8_E4M3,0.553443,7.76045
64,256,131072,64,256,128,4,FP8_E4M3,0.42673,10.0648
64,256,131072,64,256,128,5,FP8_E4M3,0.409278,10.494
# BUILD_FAILED: 64,256,128,6,1
# BUILD_FAILED: 64,256,128,7,1
# BUILD_FAILED: 64,256,128,8,1
64,256,131072,64,256,256,0,FP8_E4M3,0.590888,7.26867
64,256,131072,64,256,256,2,FP8_E4M3,0.595382,7.2138
# BUILD_FAILED: 64,256,256,3,1
# BUILD_FAILED: 64,256,256,4,1
# BUILD_FAILED: 64,256,256,5,1
# BUILD_FAILED: 64,256,256,6,1
# BUILD_FAILED: 64,256,256,7,1
# BUILD_FAILED: 64,256,256,8,1
# BUILD_FAILED: 64,256,512,0,1
# BUILD_FAILED: 64,256,512,2,1
# BUILD_FAILED: 64,256,512,3,1
# BUILD_FAILED: 64,256,512,4,1
# BUILD_FAILED: 64,256,512,5,1
# BUILD_FAILED: 64,256,512,6,1
# BUILD_FAILED: 64,256,512,7,1
# BUILD_FAILED: 64,256,512,8,1
128,16,131072,128,16,32,0,FP8_E4M3,0.399083,1.34526
128,16,131072,128,16,32,2,FP8_E4M3,0.878179,0.611346
128,16,131072,128,16,32,3,FP8_E4M3,0.583466,0.920142
128,16,131072,128,16,32,4,FP8_E4M3,0.444106,1.20888
128,16,131072,128,16,32,5,FP8_E4M3,0.391714,1.37057
128,16,131072,128,16,32,6,FP8_E4M3,0.391906,1.3699
128,16,131072,128,16,32,7,FP8_E4M3,0.389368,1.37883
128,16,131072,128,16,32,8,FP8_E4M3,0.40191,1.3358
128,16,131072,128,16,64,0,FP8_E4M3,0.212005,2.53235
128,16,131072,128,16,64,2,FP8_E4M3,0.513515,1.04548
128,16,131072,128,16,64,3,FP8_E4M3,0.317165,1.69272
128,16,131072,128,16,64,4,FP8_E4M3,0.2406,2.23138
128,16,131072,128,16,64,5,FP8_E4M3,0.205314,2.61488
128,16,131072,128,16,64,6,FP8_E4M3,0.199112,2.69633
128,16,131072,128,16,64,7,FP8_E4M3,0.199936,2.68521
128,16,131072,128,16,64,8,FP8_E4M3,0.205298,2.61509
128,16,131072,128,16,128,0,FP8_E4M3,0.114942,4.67078
128,16,131072,128,16,128,2,FP8_E4M3,0.273032,1.96633
128,16,131072,128,16,128,3,FP8_E4M3,0.178982,2.99957
128,16,131072,128,16,128,4,FP8_E4M3,0.140546,3.81991
128,16,131072,128,16,128,5,FP8_E4M3,0.116178,4.62112
128,16,131072,128,16,128,6,FP8_E4M3,0.119125,4.50679
128,16,131072,128,16,128,7,FP8_E4M3,0.123278,4.35495
128,16,131072,128,16,128,8,FP8_E4M3,0.12639,4.24772
128,16,131072,128,16,256,0,FP8_E4M3,0.133611,4.01816
128,16,131072,128,16,256,2,FP8_E4M3,0.219715,2.44349
128,16,131072,128,16,256,3,FP8_E4M3,0.127451,4.21236
128,16,131072,128,16,256,4,FP8_E4M3,0.119538,4.49123
128,16,131072,128,16,256,5,FP8_E4M3,0.125184,4.28865
128,16,131072,128,16,256,6,FP8_E4M3,0.128646,4.17323
# BUILD_FAILED: 128,16,256,7,1
# BUILD_FAILED: 128,16,256,8,1
128,16,131072,128,16,512,0,FP8_E4M3,0.138347,3.88061
128,16,131072,128,16,512,2,FP8_E4M3,0.183811,2.92077
128,16,131072,128,16,512,3,FP8_E4M3,0.149718,3.58587
# BUILD_FAILED: 128,16,512,4,1
# BUILD_FAILED: 128,16,512,5,1
# BUILD_FAILED: 128,16,512,6,1
# BUILD_FAILED: 128,16,512,7,1
# BUILD_FAILED: 128,16,512,8,1
128,32,131072,128,32,32,0,FP8_E4M3,0.529917,2.02625
128,32,131072,128,32,32,2,FP8_E4M3,0.897563,1.19629
128,32,131072,128,32,32,3,FP8_E4M3,0.599104,1.79225
128,32,131072,128,32,32,4,FP8_E4M3,0.457597,2.34648
128,32,131072,128,32,32,5,FP8_E4M3,0.443138,2.42304
128,32,131072,128,32,32,6,FP8_E4M3,0.432378,2.48334
128,32,131072,128,32,32,7,FP8_E4M3,0.428909,2.50343
128,32,131072,128,32,32,8,FP8_E4M3,0.429821,2.49811
128,32,131072,128,32,64,0,FP8_E4M3,0.219574,4.8901
128,32,131072,128,32,64,2,FP8_E4M3,0.505992,2.12205
128,32,131072,128,32,64,3,FP8_E4M3,0.330992,3.24401
128,32,131072,128,32,64,4,FP8_E4M3,0.258234,4.15803
128,32,131072,128,32,64,5,FP8_E4M3,0.219602,4.8895
128,32,131072,128,32,64,6,FP8_E4M3,0.225875,4.75369
128,32,131072,128,32,64,7,FP8_E4M3,0.233768,4.59319
128,32,131072,128,32,64,8,FP8_E4M3,0.242573,4.42647
128,32,131072,128,32,128,0,FP8_E4M3,0.133302,8.05493
128,32,131072,128,32,128,2,FP8_E4M3,0.278522,3.85515
128,32,131072,128,32,128,3,FP8_E4M3,0.186662,5.75232
128,32,131072,128,32,128,4,FP8_E4M3,0.147459,7.28162
128,32,131072,128,32,128,5,FP8_E4M3,0.12479,8.60436
128,32,131072,128,32,128,6,FP8_E4M3,0.13003,8.25762
128,32,131072,128,32,128,7,FP8_E4M3,0.133509,8.04248
128,32,131072,128,32,128,8,FP8_E4M3,0.116893,9.1857
128,32,131072,128,32,256,0,FP8_E4M3,0.12203,8.79897
128,32,131072,128,32,256,2,FP8_E4M3,0.211,5.08882
128,32,131072,128,32,256,3,FP8_E4M3,0.136123,7.88801
128,32,131072,128,32,256,4,FP8_E4M3,0.123165,8.71793
128,32,131072,128,32,256,5,FP8_E4M3,0.127338,8.43224
# BUILD_FAILED: 128,32,256,6,1
# BUILD_FAILED: 128,32,256,7,1
# BUILD_FAILED: 128,32,256,8,1
128,32,131072,128,32,512,0,FP8_E4M3,0.180168,5.95967
128,32,131072,128,32,512,2,FP8_E4M3,0.16429,6.53566
# BUILD_FAILED: 128,32,512,3,1
# BUILD_FAILED: 128,32,512,4,1
# BUILD_FAILED: 128,32,512,5,1
# BUILD_FAILED: 128,32,512,6,1
# BUILD_FAILED: 128,32,512,7,1
# BUILD_FAILED: 128,32,512,8,1
128,64,131072,128,64,32,0,FP8_E4M3,0.520672,4.12445
128,64,131072,128,64,32,2,FP8_E4M3,0.962766,2.23053
128,64,131072,128,64,32,3,FP8_E4M3,0.646435,3.32204
128,64,131072,128,64,32,4,FP8_E4M3,0.513811,4.17952
128,64,131072,128,64,32,5,FP8_E4M3,0.514006,4.17793
128,64,131072,128,64,32,6,FP8_E4M3,0.511576,4.19778
128,64,131072,128,64,32,7,FP8_E4M3,0.514784,4.17162
128,64,131072,128,64,32,8,FP8_E4M3,0.514526,4.17371
128,64,131072,128,64,64,0,FP8_E4M3,0.268776,7.98986
128,64,131072,128,64,64,2,FP8_E4M3,0.527182,4.07351
128,64,131072,128,64,64,3,FP8_E4M3,0.351725,6.10558
128,64,131072,128,64,64,4,FP8_E4M3,0.265646,8.08399
128,64,131072,128,64,64,5,FP8_E4M3,0.26051,8.24337
128,64,131072,128,64,64,6,FP8_E4M3,0.268464,7.99915
128,64,131072,128,64,64,7,FP8_E4M3,0.278238,7.71814
128,64,131072,128,64,64,8,FP8_E4M3,0.290314,7.39712
128,64,131072,128,64,128,0,FP8_E4M3,0.160696,13.3636
128,64,131072,128,64,128,2,FP8_E4M3,0.354829,6.05217
128,64,131072,128,64,128,3,FP8_E4M3,0.244019,8.80047
128,64,131072,128,64,128,4,FP8_E4M3,0.194986,11.0136
128,64,131072,128,64,128,5,FP8_E4M3,0.186966,11.4859
128,64,131072,128,64,128,6,FP8_E4M3,0.139906,15.3495
128,64,131072,128,64,128,7,FP8_E4M3,0.139998,15.3393
128,64,131072,128,64,128,8,FP8_E4M3,0.145461,14.7633
128,64,131072,128,64,256,0,FP8_E4M3,0.149763,14.3392
128,64,131072,128,64,256,2,FP8_E4M3,0.244136,8.79626
128,64,131072,128,64,256,3,FP8_E4M3,0.170443,12.5994
128,64,131072,128,64,256,4,FP8_E4M3,0.16607,12.9312
# BUILD_FAILED: 128,64,256,5,1
# BUILD_FAILED: 128,64,256,6,1
# BUILD_FAILED: 128,64,256,7,1
# BUILD_FAILED: 128,64,256,8,1
128,64,131072,128,64,512,0,FP8_E4M3,0.227677,9.43216
128,64,131072,128,64,512,2,FP8_E4M3,0.235979,9.10031
# BUILD_FAILED: 128,64,512,3,1
# BUILD_FAILED: 128,64,512,4,1
# BUILD_FAILED: 128,64,512,5,1
# BUILD_FAILED: 128,64,512,6,1
# BUILD_FAILED: 128,64,512,7,1
# BUILD_FAILED: 128,64,512,8,1
128,128,131072,128,128,32,0,FP8_E4M3,0.691979,6.20679
128,128,131072,128,128,32,2,FP8_E4M3,1.74356,2.46333
128,128,131072,128,128,32,3,FP8_E4M3,1.15905,3.70559
128,128,131072,128,128,32,4,FP8_E4M3,0.91783,4.67948
128,128,131072,128,128,32,5,FP8_E4M3,0.741749,5.79033
128,128,131072,128,128,32,6,FP8_E4M3,0.694517,6.18411
128,128,131072,128,128,32,7,FP8_E4M3,0.689189,6.23192
128,128,131072,128,128,32,8,FP8_E4M3,0.682797,6.29026
128,128,131072,128,128,64,0,FP8_E4M3,0.347005,12.3773
128,128,131072,128,128,64,2,FP8_E4M3,0.939704,4.57055
128,128,131072,128,128,64,3,FP8_E4M3,0.626758,6.85267
128,128,131072,128,128,64,4,FP8_E4M3,0.463626,9.26387
128,128,131072,128,128,64,5,FP8_E4M3,0.384195,11.1791
128,128,131072,128,128,64,6,FP8_E4M3,0.376272,11.4145
128,128,131072,128,128,64,7,FP8_E4M3,0.384157,11.1802
128,128,131072,128,128,64,8,FP8_E4M3,0.356037,12.0633
128,128,131072,128,128,128,0,FP8_E4M3,0.197974,21.6946
128,128,131072,128,128,128,2,FP8_E4M3,0.544403,7.88931
128,128,131072,128,128,128,3,FP8_E4M3,0.368507,11.655
128,128,131072,128,128,128,4,FP8_E4M3,0.282677,15.1939
128,128,131072,128,128,128,5,FP8_E4M3,0.218254,19.6787
128,128,131072,128,128,128,6,FP8_E4M3,0.194206,22.1155
128,128,131072,128,128,128,7,FP8_E4M3,0.198746,21.6104
# BUILD_FAILED: 128,128,128,8,1
128,128,131072,128,128,256,0,FP8_E4M3,0.254485,16.8771
128,128,131072,128,128,256,2,FP8_E4M3,0.377506,11.3772
128,128,131072,128,128,256,3,FP8_E4M3,0.238192,18.0315
# BUILD_FAILED: 128,128,256,4,1
# BUILD_FAILED: 128,128,256,5,1
# BUILD_FAILED: 128,128,256,6,1
# BUILD_FAILED: 128,128,256,7,1
# BUILD_FAILED: 128,128,256,8,1
# BUILD_FAILED: 128,128,512,0,1
# BUILD_FAILED: 128,128,512,2,1
# BUILD_FAILED: 128,128,512,3,1
# BUILD_FAILED: 128,128,512,4,1
# BUILD_FAILED: 128,128,512,5,1
# BUILD_FAILED: 128,128,512,6,1
# BUILD_FAILED: 128,128,512,7,1
# BUILD_FAILED: 128,128,512,8,1
128,192,131072,128,192,32,0,FP8_E4M3,0.863104,7.46428
128,192,131072,128,192,32,2,FP8_E4M3,2.53746,2.53894
128,192,131072,128,192,32,3,FP8_E4M3,1.81531,3.54896
128,192,131072,128,192,32,4,FP8_E4M3,1.44608,4.45512
128,192,131072,128,192,32,5,FP8_E4M3,1.24567,5.17187
128,192,131072,128,192,32,6,FP8_E4M3,1.03335,6.23456
128,192,131072,128,192,32,7,FP8_E4M3,0.961626,6.69954
128,192,131072,128,192,32,8,FP8_E4M3,0.867406,7.42726
128,192,131072,128,192,64,0,FP8_E4M3,0.433195,14.8719
128,192,131072,128,192,64,2,FP8_E4M3,1.34812,4.77885
128,192,131072,128,192,64,3,FP8_E4M3,0.930402,6.92438
128,192,131072,128,192,64,4,FP8_E4M3,0.687851,9.36605
128,192,131072,128,192,64,5,FP8_E4M3,0.638163,10.0953
128,192,131072,128,192,64,6,FP8_E4M3,0.56956,11.3113
128,192,131072,128,192,64,7,FP8_E4M3,0.484445,13.2986
128,192,131072,128,192,64,8,FP8_E4M3,0.460326,13.9954
128,192,131072,128,192,128,0,FP8_E4M3,0.350298,18.3914
128,192,131072,128,192,128,2,FP8_E4M3,0.760632,8.46987
128,192,131072,128,192,128,3,FP8_E4M3,0.522022,12.3413
128,192,131072,128,192,128,4,FP8_E4M3,0.423243,15.2216
128,192,131072,128,192,128,5,FP8_E4M3,0.334886,19.2377
# BUILD_FAILED: 128,192,128,6,1
# BUILD_FAILED: 128,192,128,7,1
# BUILD_FAILED: 128,192,128,8,1
128,192,131072,128,192,256,0,FP8_E4M3,0.52944,12.1684
128,192,131072,128,192,256,2,FP8_E4M3,0.513528,12.5455
# BUILD_FAILED: 128,192,256,3,1
# BUILD_FAILED: 128,192,256,4,1
# BUILD_FAILED: 128,192,256,5,1
# BUILD_FAILED: 128,192,256,6,1
# BUILD_FAILED: 128,192,256,7,1
# BUILD_FAILED: 128,192,256,8,1
# BUILD_FAILED: 128,192,512,0,1
# BUILD_FAILED: 128,192,512,2,1
# BUILD_FAILED: 128,192,512,3,1
# BUILD_FAILED: 128,192,512,4,1
# BUILD_FAILED: 128,192,512,5,1
# BUILD_FAILED: 128,192,512,6,1
# BUILD_FAILED: 128,192,512,7,1
# BUILD_FAILED: 128,192,512,8,1
128,256,131072,128,256,32,0,FP8_E4M3,1.04622,8.21047
128,256,131072,128,256,32,2,FP8_E4M3,2.86368,2.99961
128,256,131072,128,256,32,3,FP8_E4M3,1.89684,4.52855
128,256,131072,128,256,32,4,FP8_E4M3,1.55926,5.50897
128,256,131072,128,256,32,5,FP8_E4M3,1.36046,6.314
128,256,131072,128,256,32,6,FP8_E4M3,1.18286,7.26203
128,256,131072,128,256,32,7,FP8_E4M3,1.10529,7.77166
128,256,131072,128,256,32,8,FP8_E4M3,1.02725,8.36203
128,256,131072,128,256,64,0,FP8_E4M3,0.520272,16.5105
128,256,131072,128,256,64,2,FP8_E4M3,1.50375,5.71235
128,256,131072,128,256,64,3,FP8_E4M3,1.00819,8.52018
128,256,131072,128,256,64,4,FP8_E4M3,0.929984,9.23665
128,256,131072,128,256,64,5,FP8_E4M3,0.689986,12.4494
128,256,131072,128,256,64,6,FP8_E4M3,0.612203,14.0312
128,256,131072,128,256,64,7,FP8_E4M3,0.54979,15.624
128,256,131072,128,256,64,8,FP8_E4M3,0.537845,15.971
128,256,131072,128,256,128,0,FP8_E4M3,0.487147,17.6331
128,256,131072,128,256,128,2,FP8_E4M3,0.836472,10.2692
128,256,131072,128,256,128,3,FP8_E4M3,0.571899,15.02
128,256,131072,128,256,128,4,FP8_E4M3,0.461848,18.5991
# BUILD_FAILED: 128,256,128,5,1
# BUILD_FAILED: 128,256,128,6,1
# BUILD_FAILED: 128,256,128,7,1
# BUILD_FAILED: 128,256,128,8,1
128,256,131072,128,256,256,0,FP8_E4M3,0.581042,14.7837
128,256,131072,128,256,256,2,FP8_E4M3,0.596739,14.3948
# BUILD_FAILED: 128,256,256,3,1
# BUILD_FAILED: 128,256,256,4,1
# BUILD_FAILED: 128,256,256,5,1
# BUILD_FAILED: 128,256,256,6,1
# BUILD_FAILED: 128,256,256,7,1
# BUILD_FAILED: 128,256,256,8,1
# BUILD_FAILED: 128,256,512,0,1
# BUILD_FAILED: 128,256,512,2,1
# BUILD_FAILED: 128,256,512,3,1
# BUILD_FAILED: 128,256,512,4,1
# BUILD_FAILED: 128,256,512,5,1
# BUILD_FAILED: 128,256,512,6,1
# BUILD_FAILED: 128,256,512,7,1
# BUILD_FAILED: 128,256,512,8,1
